{
  "$schema": "https://json-schema.org/draft/2020-12/schema",
  "$id": "https://aimslens.example/schemas/followup_priority_request.schema.json",
  "title": "AIMS Lens Paper Follow-up Priority Request",
  "type": "object",
  "required": [
    "categories",
    "parent_distribution",
    "evidence",
    "permitted_categories",
    "kappa_company",
    "temporal_decay_rate_per_day",
    "routing_levels"
  ],
  "properties": {
    "categories": {
      "type": "array",
      "minItems": 1,
      "items": {
        "type": "string"
      },
      "uniqueItems": true
    },
    "parent_distribution": {
      "type": "object",
      "additionalProperties": {
        "type": "number",
        "minimum": 0
      }
    },
    "evidence": {
      "type": "array",
      "items": {
        "type": "object",
        "required": [
          "category",
          "authorized",
          "quality",
          "age_days"
        ],
        "properties": {
          "category": {
            "type": "string"
          },
          "authorized": {
            "type": "boolean"
          },
          "quality": {
            "type": "number",
            "minimum": 0,
            "maximum": 1
          },
          "age_days": {
            "type": "number",
            "minimum": 0
          }
        },
        "additionalProperties": false
      }
    },
    "permitted_categories": {
      "type": "array",
      "items": {
        "type": "string"
      },
      "uniqueItems": true
    },
    "routing_gamma": {
      "type": "number",
      "exclusiveMinimum": 0,
      "maximum": 1,
      "default": 0.7
    },
    "support_tau": {
      "type": "number",
      "exclusiveMinimum": 0,
      "default": 8.0
    },
    "routing_levels": {
      "type": "array",
      "minItems": 1,
      "items": {
        "type": "object",
        "required": [
          "name",
          "backoff_distance",
          "authorized",
          "applicable",
          "coverage",
          "distribution"
        ],
        "properties": {
          "name": {
            "type": "string",
            "pattern": "^L[0-5](?:_|$)"
          },
          "backoff_distance": {
            "type": "integer",
            "minimum": 0,
            "maximum": 5
          },
          "authorized": {
            "type": "boolean"
          },
          "applicable": {
            "type": "boolean"
          },
          "coverage": {
            "type": "number",
            "minimum": 0,
            "maximum": 1
          },
          "distribution": {
            "type": "object",
            "additionalProperties": {
              "type": "number",
              "minimum": 0
            }
          }
        },
        "additionalProperties": false,
        "allOf": [
          {
            "if": {
              "properties": {
                "name": {
                  "pattern": "^L0(?:_|$)"
                }
              },
              "required": [
                "name"
              ]
            },
            "then": {
              "properties": {
                "backoff_distance": {
                  "const": 0
                }
              }
            }
          },
          {
            "if": {
              "properties": {
                "name": {
                  "pattern": "^L1(?:_|$)"
                }
              },
              "required": [
                "name"
              ]
            },
            "then": {
              "properties": {
                "backoff_distance": {
                  "const": 1
                }
              }
            }
          },
          {
            "if": {
              "properties": {
                "name": {
                  "pattern": "^L2(?:_|$)"
                }
              },
              "required": [
                "name"
              ]
            },
            "then": {
              "properties": {
                "backoff_distance": {
                  "const": 2
                }
              }
            }
          },
          {
            "if": {
              "properties": {
                "name": {
                  "pattern": "^L3(?:_|$)"
                }
              },
              "required": [
                "name"
              ]
            },
            "then": {
              "properties": {
                "backoff_distance": {
                  "const": 3
                }
              }
            }
          },
          {
            "if": {
              "properties": {
                "name": {
                  "pattern": "^L4(?:_|$)"
                }
              },
              "required": [
                "name"
              ]
            },
            "then": {
              "properties": {
                "backoff_distance": {
                  "const": 4
                }
              }
            }
          },
          {
            "if": {
              "properties": {
                "name": {
                  "pattern": "^L5(?:_|$)"
                }
              },
              "required": [
                "name"
              ]
            },
            "then": {
              "properties": {
                "backoff_distance": {
                  "const": 5
                }
              }
            }
          }
        ]
      },
      "contains": {
        "type": "object",
        "required": [
          "name",
          "backoff_distance"
        ],
        "properties": {
          "name": {
            "type": "string",
            "pattern": "^L0(?:_|$)"
          },
          "backoff_distance": {
            "const": 0
          }
        }
      },
      "minContains": 1,
      "maxContains": 1
    },
    "kappa_company": {
      "type": "number",
      "exclusiveMinimum": 0
    },
    "temporal_decay_rate_per_day": {
      "type": "number",
      "minimum": 0
    },
    "abstention_threshold": {
      "type": "number",
      "minimum": 0,
      "maximum": 1,
      "default": 0.3
    }
  },
  "additionalProperties": false
}
